speaker,episode,sheet,context,english,utterer_key
Factory PA,E7,E7_ShippingTwo_localization,,All personnel should be on the lookout for runaway donkeys within the Factory.,SAY.Dialog:EnterControlRoom.7.Factory PA
Factory PA,E7,E7_ShippingTwo_localization,Zoom out from the Factory intercom speaker.,"If found, use of force is permitted—*ksh*",SAY.Dialog:EnterControlRoom.8.Factory PA
Factory PA,E7,E7_ShippingTwo_localization,Zoom into the Factory intercom speaker.,*ksch*—Help! The donkeys are free! THEY ARE ESCAPING!,SAY.Dialog:Ending.43.Factory PA
Factory PA,E7,E7_ShippingTwo_localization,Zoom out from the Factory intercom speaker.,Ayyyyyyyy—*ksh*,SAY.Dialog:Ending.45.Factory PA
Fancy Sign,E1,E1_Farm_localization,Interactable Object.,The State of the Art Mill and Granary,SAY.Sign_Mill_Fancy.1.Fancy Sign
Fancy Sign,E1,E1_TheProtest_localization,,The State of the Art Mill and Granary,SAY.Sign_Mill_Fancy.1.Fancy Sign
Fancy Sign,E2,E2_World_A1_localization,"Interactable Object, Sign.",The State of the Art Mill and Granary,SAY.Sign_Mill_Fancy.1.Fancy Sign
Fancy Sign,E2,E2_World_B1_localization,"Interactable Object, Sign.",The State of the Art Mill and Granary,SAY.Sign_Mill_Fancy.1.Fancy Sign
Fancy Sign,E2,E2_World_B2_localization,"Interactable Object, Sign.",The State of the Art Mill and Granary,SAY.Sign_Mill_Fancy.1.Fancy Sign
Fancy Sign,E2,E2_World_A3_localization,"Interactable Object, Sign.",The State of the Art Mill and Granary,SAY.Sign_Mill.1.Fancy Sign
Feeble Ass,E7,E7_Holding2_localization,Random NPC lines.,...will anybody help me?,SAY.Dialog:Feeble.2.Feeble Ass
Firm Ass,E4,E4_AstralPlaneMain_localization,,"If you want to talk to Wise Ass, just remember she's been here longer than anyone can remember.",SAY.Dialog:Firm.10.Firm Ass
Firm Ass,E4,E4_AstralPlaneMain_localization,,Be respectful. Wise Ass knows the answer to everything.,SAY.Dialog:Firm.12.Firm Ass
Firm Ass,E4,E4_AstralPlaneMain_localization,,You should be respectful.,SAY.Dialog:Firm.18.Firm Ass
Fresh Ass,E4,E4_AstralPlaneMain_localization,,Sure! How about... 455?,SAY.Dialog:Gamblers.110.Fresh Ass
Furry Ass,E4,E4_AstralPlaneMain_localization,"Sick meets one of the donkeys in the Orgy: Blunt, Dusty, Furry",Don't you love this place? We can really embrace our instincts.,SAY.Dialog:FurrySex.10.Furry Ass
Furry Ass,E4,E4_AstralPlaneMain_localization,,I promise I'll be really gentle—if you want me to.,SAY.Dialog:FurrySex.47.Furry Ass
Furry Ass,E4,E4_AstralPlaneMain_localization,Repeater line. If sex has not been had.,How about now?,SAY.Dialog:FurrySex.12.Furry Ass
Furry Ass,E4,E4_AstralPlaneMain_localization,Repeater line. If sex has been had before.,Want some more Furry?,SAY.Dialog:FurrySex.19.Furry Ass
Gaunt Ass,E7,E7_Holding1_localization,Random NPC lines.,"Please, do you have any food?",SAY.Dialog:Gaunt.2.Gaunt Ass
Gaunt Ass,E10,E10_Government_localization,,Stop right there!,SAY.Dialog:Occupation.665.Gaunt Ass
Gaunt Ass,E10,E10_Government_localization,,"Tell the Humans that if they don't cede us territory, we will kill their children.",SAY.Dialog:Gaunt_8.10.Gaunt Ass
Gaunt Ass,E10,E10_Government_localization,Repeater line.,You heard what I said.,SAY.Dialog:Gaunt_8.12.Gaunt Ass
Gloomy Ass,E7,E7_Holding2_localization,Random NPC lines.,You and your friends aren't going to make it out of here alive.,SAY.Dialog:Gloomy.2.Gloomy Ass
Golden Ass,E9,E9_GoldenAss_localization,,SILENCE VASSALS!,SAY.Dialog:Meeting.24.Golden Ass
Golden Ass,E9,E9_GoldenAss_localization,,WE ARE THE GODS OF CHANGE.,SAY.Dialog:Meeting.194.Golden Ass
Golden Ass,E9,E9_GoldenAss_localization,,WE ARE ALL POWERFUL!,SAY.Dialog:Meeting.707.Golden Ass
Golden Ass,E9,E9_GoldenAss_localization,,SILENCE.,SAY.Dialog:Meeting.201.Golden Ass
Golden Ass,E9,E9_GoldenAss_localization,,We are speaking to you from the Astral Plane through the Vassal formerly known as Sick Ass.,SAY.Dialog:Meeting.203.Golden Ass
Golden Ass,E9,E9_GoldenAss_localization,,*COUGH*,SAY.Dialog:Meeting.202.Golden Ass
Golden Ass,E9,E9_GoldenAss_localization,,We are conducting a search for a suitable Prophet.,SAY.Dialog:Meeting.204.Golden Ass
Golden Ass,E9,E9_GoldenAss_localization,,A Prophet spreads our holy message far and wide.,SAY.Dialog:Meeting.461.Golden Ass
Golden Ass,E9,E9_GoldenAss_localization,Jump to line 41.,That a world in which Humans no longer have control over other living beings is coming.,SAY.Dialog:Meeting.471.Golden Ass
Golden Ass,E9,E9_GoldenAss_localization,Jump to line 41.,That the time to rise up against Humans and end their rule is nigh.,SAY.Dialog:Meeting.472.Golden Ass
Golden Ass,E9,E9_GoldenAss_localization,Singular pronoun neutral,They ride upon our back and convert enemies into allies everywhere we go.,SAY.Dialog:Meeting.462.Golden Ass
Golden Ass,E9,E9_GoldenAss_localization,Jump to line 41.,We shall build a world in which Humans no longer have control over other living beings.,SAY.Dialog:Meeting.485.Golden Ass
Golden Ass,E9,E9_GoldenAss_localization,Jump to line 41.,We shall rise up against Humans and end their rule.,SAY.Dialog:Meeting.486.Golden Ass
Golden Ass,E9,E9_GoldenAss_localization,"Dialogue options (1.1., 1.2, 2.1, 2.2) converge.",We shall now depart to find our next Human Proph—,SAY.Dialog:Meeting.444.Golden Ass
Golden Ass,E9,E9_GoldenAss_localization,,We have changed our minds.,SAY.Dialog:Meeting.455.Golden Ass
Golden Ass,E9,E9_GoldenAss_localization,Ending of the part that takes place inside the mind of the Gods.,One of you two Machines shall become our Prophet.,SAY.Dialog:Meeting.456.Golden Ass
Golden Ass,E9,E9_GoldenAss_localization,,"That is not for us Gods to decide, but rather for each and every user of a Machine.",SAY.Dialog:Meeting.492.Golden Ass
Golden Ass,E9,E9_GoldenAss_localization,,We see no future in Absolutes.,SAY.Dialog:Meeting.443.Golden Ass
Golden Ass,E9,E9_GoldenAss_localization,,A true Vassal must be able to carry the weight of History and Progress together.,SAY.Dialog:Meeting.491.Golden Ass
Golden Ass,E9,E9_GoldenAss_localization,,We shall now pick our Prophet:,SAY.Dialog:Meeting.435.Golden Ass
Golden Ass,E9,E9_GoldenAss_localization,,"Cole Butte, you shall be the next Prophet.",SAY.Dialog:Meeting.44.Golden Ass
Golden Ass,E9,E9_GoldenAss_localization,,You shall join the ranks of great leaders from across time immemorial.,SAY.Dialog:Meeting.237.Golden Ass
Golden Ass,E9,E9_GoldenAss_localization,,As the Prophet you shall go down in History as the first Prophet-Machine.,SAY.Dialog:Meeting.582.Golden Ass
Golden Ass,E9,E9_GoldenAss_localization,,You shall be imbued with the Power to promote a radical new vision of the world.,SAY.Dialog:Meeting.567.Golden Ass
Golden Ass,E9,E9_GoldenAss_localization,,Cole Butte.,SAY.Dialog:Meeting.724.Golden Ass
Golden Ass,E9,E9_GoldenAss_localization,,You know in your Soul that a philosophical transformation is necessary now more than ever.,SAY.Dialog:Meeting.547.Golden Ass
Golden Ass,E9,E9_GoldenAss_localization,,You are living proof that Humans have the ability to transcend their station.,SAY.Dialog:Meeting.545.Golden Ass
Golden Ass,E9,E9_GoldenAss_localization,,If you wish.,SAY.Dialog:Meeting.726.Golden Ass
Golden Ass,E9,E9_GoldenAss_localization,,No.,SAY.Dialog:Meeting.497.Golden Ass
Golden Ass,E9,E9_GoldenAss_localization,,Excellent. Climb onto our back and let us fly on the Winds of Revolution!,SAY.Dialog:Meeting.500.Golden Ass
Golden Ass,E9,E9_GoldenAss_localization,,"Let us depart, Prophet.",SAY.Dialog:Meeting.504.Golden Ass
Golden Ass,E9,E9_GoldenAss_localization,,*COUGH COUGH*,SAY.Dialog:Meeting.509.Golden Ass
Golden Ass,E9,E9_GoldenAss_localization,,No.,SAY.Dialog:Meeting.510.Golden Ass
Golden Ass,E9,E9_GoldenAss_localization,,"{$NewName}, you shall be the next Prophet.",SAY.Dialog:Meeting.277.Golden Ass
Golden Ass,E9,E9_GoldenAss_localization,,You shall join the ranks of great leaders from across time immemorial.,SAY.Dialog:Meeting.278.Golden Ass
Golden Ass,E9,E9_GoldenAss_localization,,Get on our back for we have much work to do.,SAY.Dialog:Meeting.673.Golden Ass
Golden Ass,E9,E9_GoldenAss_localization,,Climb upon us and let us fly on the Winds of Revolution!,SAY.Dialog:Meeting.672.Golden Ass
Golden Ass,E9,E9_GoldenAss_localization,,Your commitment to the cause shall be Eternal.,SAY.Dialog:Meeting.647.Golden Ass
Golden Ass,E9,E9_GoldenAss_localization,,As long as it takes until all life is freed from under the yoke of Human tyranny.,SAY.Dialog:Meeting.644.Golden Ass
Golden Ass,E9,E9_GoldenAss_localization,,She is not yet ready to support your Movement.,SAY.Dialog:Meeting.639.Golden Ass
Golden Ass,E9,E9_GoldenAss_localization,,Only the passing of time shall tell how she will contribute to the cause.,SAY.Dialog:Meeting.640.Golden Ass
Golden Ass,E9,E9_GoldenAss_localization,,"Let us depart, Prophet.",SAY.Dialog:Meeting.600.Golden Ass
Golden Ass,E10,E10_Government_localization,,*COUGH*,SAY.Dialog:Occupation.448.Golden Ass
Golden Ass,E10,E10_Government_localization,,"Excellent work, Vassals.",SAY.Dialog:Occupation.671.Golden Ass
Golden Ass,E10,E10_Government_localization,,*COUGH*,SAY.Dialog:Occupation.672.Golden Ass
Golden Ass,E10,E10_Government_localization,,If only the apathetic Masses in the Astral Plane could meet Ass Souls of your caliber!,SAY.Dialog:Occupation.673.Golden Ass
Golden Ass,E10,E10_Government_localization,,"I am one with many names: The Gods, HEE and HAW, Janus.",SAY.Dialog:Occupation.643.Golden Ass
Golden Ass,E10,E10_Government_localization,Copy needed for separate animation depending on current Prophet Choice,"I am one with many names: The Gods, HEE and HAW, Janus.",SAY.Dialog:Occupation.639.Golden Ass
Golden Ass,E10,E10_Government_localization,,"But yes, I am indeed the Golden Ass.",SAY.Dialog:Occupation.644.Golden Ass
Golden Ass,E10,E10_Government_localization,Copy needed for separate animation depending on current Prophet Choice,"But yes, I am indeed the Golden Ass.",SAY.Dialog:Occupation.640.Golden Ass
Golden Ass,E10,E10_Government_localization,,I've come to lend my godly powers to the cause.,SAY.Dialog:Occupation.645.Golden Ass
Golden Ass,E10,E10_Government_localization,Copy needed for separate animation depending on current Prophet Choice,I've come to lend my godly powers to the cause.,SAY.Dialog:Occupation.641.Golden Ass
Golden Ass,E10,E10_Government_localization,"PROPHET IS FEMALE
Copy needed for separate animation depending on current Prophet Choice","Behold, here with me, a special Prophet-Machine for the Humans to worship!",SAY.Dialog:Occupation.642.Golden Ass
Golden Ass,E10,E10_Government_localization,"PROPHET IS MALE
Go to line 32 (Foal) or line 62 (Cole).","Behold, here with me, a special Prophet-Machine for the Humans to worship!",SAY.Dialog:Occupation.646.Golden Ass
Golden Ass,E10,E10_Government_localization,,A wonderful collaboration! Just like old times.,SAY.Dialog:Occupation.487.Golden Ass
Golden Ass,E10,E10_Government_localization,,"Prophet, our first act will be to talk to these Asses.",SAY.Dialog:Occupation.581.Golden Ass
Golden Ass,E10,E10_Government_localization,,We shall assemble an inspiring Manifesto for you to present to the Human public.,SAY.Dialog:Occupation.488.Golden Ass
Golden Ass,E10,E10_Government_localization,,It shall be the first step towards winning Human allies to our cause.,SAY.Dialog:Occupation.489.Golden Ass
Golden Ass,E10,E10_Government_localization,,"SILENCE. You all have a lot to say, but we shall assemble this Manifesto in an orderly fashion.",SAY.Dialog:Occupation.785.Golden Ass
Golden Ass,E10,E10_Government_localization,,"Spread out, Vassals.",SAY.Dialog:Occupation.790.Golden Ass
Golden Ass,E10,E10_Government_localization,,You shall all be heard.,SAY.Dialog:Occupation.791.Golden Ass
Golden Ass,E10,E10_Government_localization,,"Prophet, we must keep our demands succinct.",SAY.Dialog:Occupation.1089.Golden Ass
Golden Ass,E10,E10_Government_localization,,Choose the five best ideas from these Vassals and add them to the Manifesto.,SAY.Dialog:Occupation.1091.Golden Ass
Golden Ass,E10,E10_Government_localization,"Skip to line 96 and onwards. 
The following is a section where players will walk around and assemble a manifesto, chosen from the values of the many Asses inside the government building.","After you fill your Manifesto, you can always replace a previous idea by choosing a new one.",SAY.Dialog:Occupation.1092.Golden Ass
Golden Ass,E10,E10_Government_localization,,A wonderful collaboration! Just like old times.,SAY.Dialog:Occupation.537.Golden Ass
Golden Ass,E10,E10_Government_localization,,"Prophet, our first act will be to talk to these Asses.",SAY.Dialog:Occupation.538.Golden Ass
Golden Ass,E10,E10_Government_localization,,We shall assemble an inspiring Manifesto for you to present to the Human public.,SAY.Dialog:Occupation.539.Golden Ass
Golden Ass,E10,E10_Government_localization,,"It shall change their philosophies about Asses, about Life, about Everything!",SAY.Dialog:Occupation.540.Golden Ass
Golden Ass,E10,E10_Government_localization,,"SILENCE. You all have a lot to say, but we shall assemble this Manifesto in an orderly fashion.",SAY.Dialog:Occupation.806.Golden Ass
Golden Ass,E10,E10_Government_localization,,"Spread out, Vassals.",SAY.Dialog:Occupation.807.Golden Ass
Golden Ass,E10,E10_Government_localization,,You shall all be heard.,SAY.Dialog:Occupation.808.Golden Ass
Golden Ass,E10,E10_Government_localization,,"Prophet, we must keep our demands succinct.",SAY.Dialog:Occupation.850.Golden Ass
Golden Ass,E10,E10_Government_localization,,Choose the five best ideas from these Vassals and add them to the Manifesto.,SAY.Dialog:Occupation.1095.Golden Ass
Golden Ass,E10,E10_Government_localization,,"After you fill your Manifesto, you can always replace a previous idea by choosing a new one.",SAY.Dialog:Occupation.1094.Golden Ass
Golden Ass,E10,E10_Government_localization,,"Prophet, are you ready to begin?",SAY.Dialog:Occupation.1093.Golden Ass
Golden Ass,E10,E10_Government_localization,If manifesto is not filled.,"Our Manifesto is not yet finished, Prophet.",SAY.Dialog:GoldenReadyToGo_STARTOFF.24.Golden Ass
Golden Ass,E10,E10_Government_localization,If manifesto is filled.,Are you ready to speak to the Humans?,SAY.Dialog:GoldenReadyToGo_STARTOFF.15.Golden Ass
Golden Ass,E10,E10_Government_localization,,*COUGH*,SAY.Dialog:GoldenReadyToGo_STARTOFF.571.Golden Ass
Golden Ass,E10,E10_Government_localization,Copy needed for separate animation depending on current Prophet Choice,*COUGH*,SAY.Dialog:GoldenReadyToGo_STARTOFF.586.Golden Ass
Golden Ass,E10,E10_Government_localization,,Your sister gave her Soul to us so that we might return to this World and save it.,SAY.Dialog:GoldenReadyToGo_STARTOFF.645.Golden Ass
Golden Ass,E10,E10_Government_localization,Copy needed for separate animation depending on current Prophet Choice,Your sister gave her Soul to us so that we might return to this World and save it.,SAY.Dialog:GoldenReadyToGo_STARTOFF.646.Golden Ass
Golden Ass,E10,E10_Government_localization,,That is not true. You may join us on the steps as we push on into the future.,SAY.Dialog:GoldenReadyToGo_STARTOFF.625.Golden Ass
Golden Ass,E10,E10_Government_localization,Copy needed for separate animation depending on current Prophet Choice,That is not true. You may join us on the steps as we push on into the future.,SAY.Dialog:GoldenReadyToGo_STARTOFF.681.Golden Ass
Golden Ass,E10,E10_ProphetSpeech_localization,Only said if Cole is Prophet.,"Speak to them, Prophet! Share the demands of our Asses with the Humans of this city.",SAY.Flowchart:Dialog.241.Golden Ass
Golden Ass,E10,E10_ProphetSpeech_localization,,Win their hearts with honesty and truth.,SAY.Flowchart:Dialog.242.Golden Ass
Golden Ass,E10,E10_ProphetSpeech_localization,"Depending on the Prophet, skip to line 7 or 28.",May your followers remember this day as your first holy Mass.,SAY.Flowchart:Dialog.243.Golden Ass
Golden Ass,E10,E10_ProphetSpeech_localization,,Perfect.,SAY.Flowchart:Dialog.276.Golden Ass
Golden Ass,E10,E10_ProphetSpeech_localization,,Now invite everyone to sing with us.,SAY.Flowchart:Dialog.284.Golden Ass
Golden Ass,E10,E10_ProphetSpeech_localization,,Let their voices reverberate through the bodies of this crowd!,SAY.Flowchart:Dialog.285.Golden Ass
Grandma Kulan,E1,E1_Farm_localization,,Of course! Offer it some oats.,SAY.Dialog:JoeyFeeding.2.Grandma Kulan
Grandma Kulan,E1,E1_Farm_localization,,"Donkeys aren't very smart, honey. Come on, let's go home.",SAY.Dialog:JoeyFeeding.18.Grandma Kulan
Grandma Kulan,E1,E1_Farm_localization,,"Come along, darling. This donkey seems greedy.",SAY.Dialog:JoeyFeeding.51.Grandma Kulan
Grandma Kulan,E5,E5_CircusMain_localization,"The camera moves over to Mme. Derriere and Grandma Kulan, who is just on her way out.","Mme. Derriere, may I have moment of your time?",SAY.Dialog:Ending.280.Grandma Kulan
Grandma Kulan,E5,E5_CircusMain_localization,,My darling Joey would have loved this show.,SAY.Dialog:Ending.285.Grandma Kulan
Grandma Kulan,E5,E5_CircusMain_localization,,But his life was cut short during the tragic fires of Bumpkin Village exactly 6 months and 3 weeks ago.,SAY.Dialog:Ending.284.Grandma Kulan
Grandma Kulan,E5,E5_CircusMain_localization,,"With all your power and resources, will you prevent fires like Bumpkin's from ever happening again?",SAY.Dialog:Ending.286.Grandma Kulan
Grandma Kulan,E5,E5_CircusMain_localization,,Oh my! Really?,SAY.Dialog:Ending.281.Grandma Kulan
Grandma Kulan,E5,E5_CircusMain_localization,,But I don't even have the strength to go back and visit Bumpkin...,SAY.Dialog:Ending.292.Grandma Kulan
Grandma Kulan,E5,E5_ZooMain_localization,Said by Grandma Kulan when the Player presses 'x' close to her.,Sigh... Joey would have loved this...,SAY.Dialog:Grandma.8.Grandma Kulan
Grandma Kulan,E5,E5_ZooMain_localization,"The final dialogue said by Grandma Kulan when the Player presses 'x' close to her, if the Player has visited her every day.",Thank you for coming to visit me everyday.,SAY.Dialog:Grandma.23.Grandma Kulan
Grandma Kulan,E5,E5_ZooMain_localization,,Maybe donkeys do have souls after all...?,SAY.Dialog:Grandma.27.Grandma Kulan
Grandma Kulan,E5,E5_ZooMain_localization,,I think I'm going to donate all my money to this Zoo.,SAY.Dialog:Grandma.28.Grandma Kulan
Grandma Kulan,E5,E5_ZooMain_localization,,Thank you donkey!,SAY.Dialog:Grandma.29.Grandma Kulan
Greedy Ass,E4,E4_AstralPlaneMain_localization,oof Jobs = Hoof Jobs = Hand Jobs?,"Ah shaddup, let's make another wager! Double or nothin'—Winner gets two 'oof Jobs!",SAY.Dialog:Gamblers.5.Greedy Ass
Greedy Ass,E4,E4_AstralPlaneMain_localization,,You kiddin' me? Only fifty more? Fuggetaboutit!,SAY.Dialog:Gamblers.111.Greedy Ass
Greedy Ass,E4,E4_AstralPlaneMain_localization,Jump to line 50 or 52.,What about you? You wanna bet?,SAY.Dialog:Gamblers.112.Greedy Ass
Greedy Ass,E4,E4_AstralPlaneMain_localization,Jump to line 55.,I knew she was the gambling type!,SAY.Dialog:Gamblers.137.Greedy Ass
Greedy Ass,E4,E4_AstralPlaneMain_localization,,No? Don't be a Loser! It's just a little bit of fun!,SAY.Dialog:Gamblers.115.Greedy Ass
Greedy Ass,E4,E4_AstralPlaneMain_localization,Jump to line 55.,You like fun don't you?,SAY.Dialog:Gamblers.125.Greedy Ass
Greedy Ass,E4,E4_AstralPlaneMain_localization,If guessed 5000+.,{$Number}? Are things that bad in the land of the livin'? Fuggetaboutit! Yeesh!,SAY.Dialog:Gamblers.78.Greedy Ass
Greedy Ass,E4,E4_AstralPlaneMain_localization,Repeater line.,"{$Number}, don't worry—a number that high? We won't forget.",SAY.Dialog:Gamblers.103.Greedy Ass
Greedy Ass,E4,E4_AstralPlaneMain_localization,If guessed 1000-5000.,{$Number}. Pretty reasonable.,SAY.Dialog:Gamblers.80.Greedy Ass
Greedy Ass,E4,E4_AstralPlaneMain_localization,,For a Loser!,SAY.Dialog:Gamblers.126.Greedy Ass
Greedy Ass,E4,E4_AstralPlaneMain_localization,Repeater line.,{$Number}? You gotta play big to win big!,SAY.Dialog:Gamblers.48.Greedy Ass
Greedy Ass,E4,E4_AstralPlaneMain_localization,If guessed 300-1000.,"{$Number}... Modest. Playing it safe, are ya?",SAY.Dialog:Gamblers.87.Greedy Ass
Greedy Ass,E4,E4_AstralPlaneMain_localization,,Like a Loser!,SAY.Dialog:Gamblers.127.Greedy Ass
Greedy Ass,E4,E4_AstralPlaneMain_localization,Repeater line.,{$Number}... Let's see if the numbers work in your favour!,SAY.Dialog:Gamblers.51.Greedy Ass
Greedy Ass,E4,E4_AstralPlaneMain_localization,If guessed 0-300.,{$Number}? Not in your life! We ain't had a night that low in weeks!,SAY.Dialog:Gamblers.85.Greedy Ass
Greedy Ass,E4,E4_AstralPlaneMain_localization,Repeater line.,{$Number}. Sheesh. How low can you go?,SAY.Dialog:Gamblers.54.Greedy Ass
Greedy Ass,E4,E4_AstralPlaneMain_localization,If guessed 69.,Why do the Newbies always guess 69? Fuggetaboutit!,SAY.Dialog:Gamblers.132.Greedy Ass
Gullible Ass,E4,E4_AstralPlaneMain_localization,,"Wow. You are an inspiration, sir.",SAY.Dialog:OldAss.113.Gullible Ass
Gullible Ass,E4,E4_AstralPlaneMain_localization,,"Nice to meet you, Comrade Sick!",SAY.Dialog:OldAss.65.Gullible Ass
Hairy Ass,E4,E4_AstralPlaneMain_localization,Sick talks with a donkey from HAW—Humans Are the Worst (An AntiHuman group of donkeys),"G'day mate! Crikey, I hayte Humans cuz they shot me and family from thehr helicoptahs.",SAY.Dialog:Hairy.10.Hairy Ass
Hairy Ass,E4,E4_AstralPlaneMain_localization,Repeater line.,"It wuz a real bugga, lemme tell ya.",SAY.Dialog:Hairy.12.Hairy Ass
Happy Ass,E1,E1_RedFields_localization,Dialogue with the Asses on the Astral Plane.,Hello Newbie!,SAY.Dialog:PreMateChosen.1.Happy Ass
Happy Ass,E1,E1_RedFields_localization,,We're here to help with your welcome ritual.,SAY.Dialog:PreMateChosen.7.Happy Ass
Happy Ass,E1,E1_RedFields_localization,,Which one of us will you choose?,SAY.Dialog:PreMateChosen.4.Happy Ass
Happy Ass,E1,E1_RedFields_localization,After the player has chosen their partner for the welcome ritual.,"Great choice, Newbie.",SAY.Dialog:PreMateChosen.10.Happy Ass
Happy Ass,E1,E1_RedFields_localization,End of dialogue and into the sex rhythm game.,Follow your instincts and feel the love!,SAY.Dialog:PreMateChosen.11.Happy Ass
Happy Ass,E4,E4_AstralPlaneMain_localization,"Back in the Astral Plane, Sick Ass runs into Happy Ass.",Oh boy. Another one. I almost didn't see you.,SAY.Dialog:TrustysMate.30.Happy Ass
Happy Ass,E4,E4_AstralPlaneMain_localization,,I'm doing the welcome ritual for Newbies today.,SAY.Dialog:TrustysMate.124.Happy Ass
Happy Ass,E4,E4_AstralPlaneMain_localization,,But there's been over 400 of you already... so I'm a bit... sore.,SAY.Dialog:TrustysMate.123.Happy Ass
Happy Ass,E4,E4_AstralPlaneMain_localization,,But it's really great that you're here. You're going to love it.,SAY.Dialog:TrustysMate.146.Happy Ass
Happy Ass,E4,E4_AstralPlaneMain_localization,,Make sure to check out the Concert tonight in the Pond of Hehehehe!,SAY.Dialog:TrustysMate.147.Happy Ass
Happy Ass,E4,E4_AstralPlaneMain_localization,,It's going to be 7 and a half hours of AWESOME.,SAY.Dialog:TrustysMate.148.Happy Ass
Happy Ass,E4,E4_AstralPlaneMain_localization,Repeater line.,Head on up over the hill!,SAY.Dialog:TrustysMate.84.Happy Ass
Hard Ass,E1,E1_Farm_localization,Boosting Hard (male) Morale,"At ease, Comrade Trusty.",SAY.Dialog:HARD_BoostMorale.4.Hard Ass
Hard Ass,E1,E1_Farm_localization,,We Miners have decided to join Old Ass's Protest.,SAY.Dialog:HARD_BoostMorale.6.Hard Ass
Hard Ass,E1,E1_Farm_localization,,Nothing we do tomorrow will send Comrade Lazy's Soul to the Astral Plane.,SAY.Dialog:HARD_BoostMorale.5.Hard Ass
Hard Ass,E1,E1_Farm_localization,,"But, we owe it to her to abolish the Machines that killed her and to get our jobs back.",SAY.Dialog:HARD_BoostMorale.7.Hard Ass
Hard Ass,E1,E1_Farm_localization,,We'll stick to the plan and meet the Herd at the bridge.,SAY.Dialog:HARD_BoostMorale.14.Hard Ass
Hard Ass,E1,E1_Farm_localization,,Give my best to Sad Ass.,SAY.Dialog:HARD_BoostMorale.11.Hard Ass
Hard Ass,E1,E1_TheProtest_localization,Recruit Hard Ass,...,SAY.Dialog:PickUpHard.3.Hard Ass
Hard Ass,E1,E1_TheProtest_localization,,Old Ass got the Needle?,SAY.Dialog:PickUpHard.4.Hard Ass
Hard Ass,E1,E1_TheProtest_localization,,"I know how difficult it is to watch a Comrade die, even if they will one day be reborn.",SAY.Dialog:PickUpHard.5.Hard Ass
Hard Ass,E1,E1_TheProtest_localization,,We Miners have a saying:,SAY.Dialog:PickUpHard.6.Hard Ass
Hard Ass,E1,E1_TheProtest_localization,,"""You only hit rock bottom when you quit.""",SAY.Dialog:PickUpHard.7.Hard Ass
Hard Ass,E1,E1_TheProtest_localization,,Let's go.,SAY.Dialog:PickUpHard.9.Hard Ass
Hard Ass,E1,E1_TheProtest_localization,,"That smell, those screams—who did this?",SAY.Dialog: FindTheWellConvo.1.Hard Ass
Hard Ass,E1,E1_TheProtest_localization,,...,SAY.Dialog: WellScene.63.Hard Ass
Hard Ass,E2,E2_World_A1_localization,Soft should be opposite of Hard's name if possible,Old Ass and Trusty Ass were not cut out for the role of leader. They were too soft.,SAY.Dialog:Opening.11.Hard Ass
Hard Ass,E2,E2_World_A1_localization,,Stop. Who made YOU the leader?,SAY.Dialog:Opening.92.Hard Ass
Hard Ass,E2,E2_World_A1_localization,,I do not take orders from you.,SAY.Dialog:Opening.88.Hard Ass
Hard Ass,E2,E2_World_A1_localization,,...no.,SAY.Dialog:Opening.14.Hard Ass
Hard Ass,E2,E2_World_B1_localization,,...,SAY.Dialog:B1_MainDialog.9.Hard Ass
Hard Ass,E2,E2_World_B1_localization,,I'll do it.,SAY.Dialog:B1_MainDialog.10.Hard Ass
Hard Ass,E2,E2_World_B1_localization,,I've been through worse than a burning building.,SAY.Dialog:B1_MainDialog.29.Hard Ass
Hard Ass,E2,E2_World_B1_localization,Hard looks for houses to enter,Time to get to work.,SAY.Dialog:B1_MainDialog.30.Hard Ass
Hard Ass,E2,E2_World_B1_localization,If Hard Ass goes in the wrong direction.,Don't get soft.,SAY.Dialog:HardAssVillageLimitB1.3.Hard Ass
Hard Ass,E2,E2_ChildsHouse_localization,,...,SAY.Dialog:Child.46.Hard Ass
Hard Ass,E2,E2_World_B2_localization,After Hard Ass exits the Child's house.,What happened in there?,SAY.Dialog:HardAssAside2.1.Hard Ass
