speaker,episode,sheet,context,english,utterer_key
Nice Ass,E2,E2_World_A1_localization,,"Heck, I'd do anything to save our Farm!",SAY.Dialog:Opening.25.Nice Ass
Nice Ass,E2,E2_World_A1_localization,If Nice Ass goes the wrong way.,"Golly, the smoke must be getting to me. This isn't the way to the Farm at all.",SAY.Dialog:SmokeMustBeGettingToMe_STARTOFF.1.Nice Ass
Nice Ass,E2,E2_World_A1_localization,If Nice Ass goes the wrong way.,"Golly, the smoke must be getting to me. This isn't the way to the Farm at all.",SAY.Dialog:FarmHouse.1.Nice Ass
Nice Ass,E2,E2_World_A1_localization,Nice arrives at the bridge over the river.,"Golly, looks like the bridge is slowing the fire down.",SAY.Dialog:NorthBridge.1.Nice Ass
Nice Ass,E2,E2_World_A1_localization,,Sad Ass! Sturdy Ass! Bad Ass! I'm coming for you!,SAY.Dialog:NorthBridge.2.Nice Ass
Nice Ass,E2,E2_World_A2_localization,"The camera fades up from black and we see Nice Ass with her plow, just outside the Fannyside Farm.","The Herd is counting on me! Yuppers, this is what I've been training for!",SAY.Dialog:A_Dialog.1.Nice Ass
Nice Ass,E2,E2_World_A2_localization,"Nice Ass begins to plow a fire line, cutting off the fire.","If I plow like I've never plowed before, I can cut the fire off and save our beautiful Farm!",SAY.Dialog:A_Dialog.6.Nice Ass
Nice Ass,E2,E2_World_A2_localization,Nice Ass succeeds with the first line of defense.,Hooray!,SAY.Dialog:B_Dialog.1.Nice Ass
Nice Ass,E2,E2_World_A2_localization,A fire ball flies on the wind and ignites a tree.,Yikes!,SAY.Dialog:B_Dialog.7.Nice Ass
Nice Ass,E2,E2_World_A2_localization,The fire spreads.,Gosh! Not the Mill!,SAY.Dialog:C_Dialog.11.Nice Ass
Nice Ass,E2,E2_World_A2_localization,The fire spreads.,Gosh! Not the Granary!,SAY.Dialog:C_Dialog.19.Nice Ass
Nice Ass,E2,E2_World_A2_localization,The fire spreads.,Jeepers! It's spreading across the Forest!,SAY.Dialog:C_Dialog.1.Nice Ass
Nice Ass,E2,E2_World_A2_localization,The fire spreads.,Yikes! We're going to lose the whole field!,SAY.Dialog:C_Dialog.25.Nice Ass
Nice Ass,E2,E2_World_A2_localization,Nice Ass plows west to attempt saving the Farm.,"If I cut the fire off at the centre, I can still save the North Half of the Farm.",SAY.Dialog:C_Dialog.23.Nice Ass
Nice Ass,E2,E2_World_A2_localization,,Not the Stable too!—,SAY.Dialog:D_Dialog.32.Nice Ass
Nice Ass,E2,E2_World_A2_localization,,Sad Ass?,SAY.Dialog:D_Dialog.9.Nice Ass
Nice Ass,E2,E2_World_A2_localization,,I've got to make it to the Outhouse before it's too late!,SAY.Dialog:D_Dialog.12.Nice Ass
Nice Ass,E2,E2_World_A2_localization,If Nice Ass hits too much fire.,Yikes...,SAY.Dialog:Burnout.1.Nice Ass
Nice Ass,E2,E2_Confession_localization,,Sad Ass! Quit hiding in the outhouse!,SAY.Dialog:Confession.19.Nice Ass
Nice Ass,E2,E2_Confession_localization,,Why are you in there?,SAY.Dialog:Confession.35.Nice Ass
Nice Ass,E2,E2_Confession_localization,Jump to line 14.,"Gee Comrade, that's not true! All of us care about you. We're here for ya!",SAY.Dialog:Confession.37.Nice Ass
Nice Ass,E2,E2_Confession_localization,,"C'mon Comrade, we have to go now!",SAY.Dialog:Confession.31.Nice Ass
Nice Ass,E2,E2_Confession_localization,Jump to line 14.,"Sad Ass, now is not the time for this, please!",SAY.Dialog:Confession.216.Nice Ass
Nice Ass,E2,E2_Confession_localization,,You're not worthless!,SAY.Dialog:Confession.68.Nice Ass
Nice Ass,E2,E2_Confession_localization,,"You're beautiful, Sad Ass.",SAY.Dialog:Confession.74.Nice Ass
Nice Ass,E2,E2_Confession_localization,Dialogue branches converge here.,"Listen, I don't know what you're talking about—",SAY.Dialog:Confession.82.Nice Ass
Nice Ass,E2,E2_Confession_localization,,Trusty Ass fell down the well trying to get water...and died.,SAY.Dialog:Confession.89.Nice Ass
Nice Ass,E2,E2_Confession_localization,,Everyone is fine!,SAY.Dialog:Confession.95.Nice Ass
Nice Ass,E2,E2_Confession_localization,,They're trapped inside their homes burning alive.,SAY.Dialog:Confession.107.Nice Ass
Nice Ass,E2,E2_Confession_localization,Dialogue branches converge here.,I'm sure the others are rescuing the Humans as we speak.,SAY.Dialog:Confession.101.Nice Ass
Nice Ass,E2,E2_Confession_localization,,"Golly, what do you mean?",SAY.Dialog:Confession.120.Nice Ass
Nice Ass,E2,E2_Confession_localization,,"Accidents happen all the time, we can fix this!",SAY.Dialog:Confession.126.Nice Ass
Nice Ass,E2,E2_Confession_localization,Jump to line 64.,I promise we can! But by golly you have to come with me now!,SAY.Dialog:Confession.143.Nice Ass
Nice Ass,E2,E2_Confession_localization,,You set the fire?,SAY.Dialog:Confession.132.Nice Ass
Nice Ass,E2,E2_Confession_localization,Jump to line 64.,"The Farm—our home! Sad Ass, how could you?!",SAY.Dialog:Confession.134.Nice Ass
Nice Ass,E2,E2_Confession_localization,,No wait! I remember! They were:,SAY.Dialog:Confession.181.Nice Ass
Nice Ass,E2,E2_Confession_localization,If the Player chooses the correct eye colour.,Dark Grey!,SAY.Dialog:Confession.192.Nice Ass
Nice Ass,E2,E2_Confession_localization,,"Gosh, of course I do!",SAY.Dialog:Confession.242.Nice Ass
Nice Ass,E2,E2_Confession_localization,,The Farm is lost...,SAY.Dialog:Confession.199.Nice Ass
Nice Ass,E2,E2_Confession_localization,,I'll keep your secret for the rest of my life.,SAY.Dialog:Confession.198.Nice Ass
Nice Ass,E2,E2_World_A3_localization,Nice Ass consoles Sad Ass as the rain starts to put out the fire.,"Sad Ass, this rain is a sign that we can start again!",SAY.Dialog:Finale.2.Nice Ass
Nice Ass,E2,E2_World_A3_localization,,We'll do what we do best—move forward one little step at a time.,SAY.Dialog:Finale.45.Nice Ass
Nice Ass,E2,E2_World_A3_localization,,No matter how uneven the ground.,SAY.Dialog:Finale.71.Nice Ass
Nice Ass,E2,E2_World_A3_localization,,I'm sure our Comrades have saved the Humans.,SAY.Dialog:Finale.97.Nice Ass
Nice Ass,E2,E2_World_A3_localization,,And the Humans are in the streets cheering.,SAY.Dialog:Finale.123.Nice Ass
Nice Ass,E2,E2_World_A3_localization,,They are singing their hearts out and dancing their butts off!,SAY.Dialog:Finale.149.Nice Ass
Nice Ass,E2,E2_World_A3_localization,,They will make today one of their annual holidays.,SAY.Dialog:Finale.175.Nice Ass
Nice Ass,E2,E2_World_A3_localization,,They will erect golden statues of heroic Asses and gather to commemorate us.,SAY.Dialog:Finale.189.Nice Ass
Nice Ass,E2,E2_World_A3_localization,,"Gosh, even one for Lazy Ass!",SAY.Dialog:Finale.201.Nice Ass
Nice Ass,E2,E2_World_A3_localization,,They will break down their Machines and throw them away.,SAY.Dialog:Finale.211.Nice Ass
Nice Ass,E2,E2_World_A3_localization,,And Humans will never call us worthless again.,SAY.Dialog:Finale.219.Nice Ass
Nice Ass,E2,E2_World_A3_localization,End of Episode 3.,"YUPPERS, WE'RE GOING BACK TO WORK!",SAY.Dialog:Finale.225.Nice Ass
Nice Ass,E3,E3_Mine1F_localization,Nice Ass enters the frame.,"Is {$NewName} giving you some good advice, Uncle Sad?",SAY.Dialog:NiceSad_Public.90.Nice Ass
Nice Ass,E3,E3_Mine1F_localization,,"Sorry little Comrade, let's give your Uncle some space.",SAY.Dialog:NiceSad_Public.100.Nice Ass
Nice Ass,E3,E3_Mine1F_localization,"End of conversation.
Player can move around again.",It's not easy for him being back inside the Mine.,SAY.Dialog:NiceSad_Public.108.Nice Ass
Nice Ass,E3,E3_Mine1F_localization,Repeater 1 for Nice Ass.,"Don't worry, it's not your fault.",SAY.Dialog:NicePostPublic.10.Nice Ass
Nice Ass,E3,E3_Mine1F_localization,,You just remind him so much of your sister.,SAY.Dialog:NicePostPublic.22.Nice Ass
Nice Ass,E3,E3_Mine1F_localization,Repeater 2 for Nice Ass.,Just give him some space.,SAY.Dialog:NicePostPublic.12.Nice Ass
Nice Ass,E3,E3_Mine1F_localization,The camera moves over to Nice Ass.,Comrade—,SAY.Dialog:TunnelNiceSadPrivate.26.Nice Ass
Nice Ass,E3,E3_Mine1F_localization,,Not a chance. I made a gosh darn promise and I intend on keeping it!,SAY.Dialog:TunnelNiceSadPrivate.70.Nice Ass
Nice Ass,E3,E3_Mine1F_localization,,We all make mistakes!,SAY.Dialog:TunnelNiceSadPrivate.34.Nice Ass
Nice Ass,E3,E3_Mine1F_localization,Jump to either line 45 or 46.,Hard Ass couldn't save the Humans.,SAY.Dialog:TunnelNiceSadPrivate.38.Nice Ass
Nice Ass,E3,E3_Mine1F_localization,"Branch 2.1.
If the stable was set on fire in Ep2.
Jump to line 47.",I wasn't fast enough to save the Stable.,SAY.Dialog:TunnelNiceSadPrivate.43.Nice Ass
Nice Ass,E3,E3_Mine1F_localization,"Branch 2.2.
If the stable was saved in Ep2.
Jump to line 47.",I only barely saved the Stable.,SAY.Dialog:TunnelNiceSadPrivate.48.Nice Ass
Nice Ass,E3,E3_Mine1F_localization,,And Trusty Ass... poor Trusty Ass.,SAY.Dialog:TunnelNiceSadPrivate.49.Nice Ass
Nice Ass,E3,E3_Mine1F_localization,its Job capital?,Maybe there won't be golden statues or dancing or our old Jobs.,SAY.Dialog:TunnelNiceSadPrivate.51.Nice Ass
Nice Ass,E3,E3_Mine1F_localization,"End of conversation.
Player can move around again.","But golly, at least we have each other!",SAY.Dialog:TunnelNiceSadPrivate.50.Nice Ass
Nice Ass,E4,E4_Mine1F_localization,NPC dialogue option. No particular order for when you talk to someone.,Golly! You must be feeling better already!,SAY.Dialog:SickNice.10.Nice Ass
Nice Ass,E4,E4_Mine1F_localization,Repeater line.,You look ready to hop back to work!,SAY.Dialog:SickNice.12.Nice Ass
Nice Ass,E4,E4_Mine1F_localization,"NPC dialogue repeater option. No particular order for when you talk to someone.
// This option is if they talked with Sick.",Sick looks like she's feeling better! I think everything's going to be alright!,SAY.Dialog:KickNice.10.Nice Ass
Nice Ass,E4,E4_Mine1F_localization,"NPC dialogue repeater option. No particular order for when you talk to someone.
// This option is if they did NOT talk with Sick.",How's Sick feeling today? You two make such a good pair!,SAY.Dialog:KickNice.12.Nice Ass
Nice Ass,E4,E4_HerdSplits_localization,,Golly. Leave Fannyside? But this is our home. I can't just leave!,SAY.Dialog:Debate.181.Nice Ass
Nice Ass,E4,E4_Mine1F_Exit_localization,NPC dialogue option. No particular order for when you talk to someone.,"If you ever change your mind, we'll welcome you back!",SAY.Dialog:NicePostSplit.10.Nice Ass
Nice Ass,E4,E4_Mine1F_Exit_localization,Repeater line.,I hope you find what you're looking for!,SAY.Dialog:NicePostSplit.12.Nice Ass
Nice Ass,E6,E6_BattleHard_localization,NPC Dialogue on entrance to the fight.,"Golly, you're about to get pounded, in less than two minutes!",SAY.DialogMaster.39.Nice Ass
Nice Ass,E6,E6_World_localization,Sequence of one-off dialogues from Nice Ass when Sturdy tries to talk to her as she's plowing.,Hi Sturdy! Bye Sturdy!,SAY.Dialog:NiceLoop.10.Nice Ass
Nice Ass,E6,E6_World_localization,,Isn't it a beautiful day?,SAY.Dialog:NiceLoop.12.Nice Ass
Nice Ass,E6,E6_World_localization,,Let's catch up later!,SAY.Dialog:NiceLoop.24.Nice Ass
Nice Ass,E6,E6_World_localization,,"Golly, you're looking well!",SAY.Dialog:NiceLoop.21.Nice Ass
Nice Ass,E6,E6_World_localization,,"Golly, what a beautiful artwork! I was drawn to it.",SAY.Dialog:BottomsUpOpening.72.Nice Ass
Nice Ass,E6,E6_World_localization,Nice Ass enters.,"Oh Thirsty, you finally opened your bar!",SAY.Dialog:BottomsUpOpening.130.Nice Ass
Nice Ass,E6,E6_World_localization,,"Aw shucks! Hey, can I have a drink? Gosh, I'm in need of some water.",SAY.Dialog:BottomsUpOpening.132.Nice Ass
Nice Ass,E6,E6_World_localization,,Golly! I think you look great!,SAY.Dialog:BottomsUpOpening.147.Nice Ass
Nice Ass,E6,E6_World_localization,,Yikes! We have to save them!,SAY.Dialog:BottomsUpOpening.220.Nice Ass
Nice Ass,E6,E6_World_localization,Nice Ass exits.,I have an idea!,SAY.Dialog:BottomsUpOpening.221.Nice Ass
Nice Ass,E6,E6_World_localization,"Nice Ass returns, driving the Tractor.",Hop on everyone!,SAY.Dialog:BottomsUpOpening.219.Nice Ass
Nice Ass,E6,E6_World_localization,,We can ride the Tractor-Machine to the City!,SAY.Dialog:BottomsUpOpening.109.Nice Ass
Nice Ass,E6,E6_World_localization,,It has been my sworn enemy for years...,SAY.Dialog:BottomsUpOpening.212.Nice Ass
Nice Ass,E6,E6_World_localization,,"I've spent countless hours analyzing its every move, training to out-plow it.",SAY.Dialog:BottomsUpOpening.214.Nice Ass
Nice Ass,E6,E6_World_localization,,"But the truth is... even in my peak condition, this Machine will always be faster than me.",SAY.Dialog:BottomsUpOpening.213.Nice Ass
Nice Ass,E6,E6_World_localization,,It's our only hope to rescue the others!,SAY.Dialog:BottomsUpOpening.215.Nice Ass
Nice Ass,E6,E6_World_localization,,"Golly, I don't know how to say this, but the Machines aren't responsible for the Fire.",SAY.Dialog:BottomsUpOpening.210.Nice Ass
Nice Ass,E6,E6_World_localization,,"Gosh, I...",SAY.Dialog:BottomsUpOpening.322.Nice Ass
Nice Ass,E6,E6_World_localization,,...promised I wouldn't say.,SAY.Dialog:BottomsUpOpening.329.Nice Ass
Nice Ass,E6,E6_World_localization,The Asses start to get into the Tractor one-by-one.,"YUPPERS, we're off to save the others!",SAY.Dialog:BottomsUpOpening.479.Nice Ass
Nice Ass,E6,E6_World_localization,"The tractor speeds off, leaving Sturdy behind. End of scene.","Slow Ass, we gotta go!",SAY.Dialog:BottomsUpOpening.150.Nice Ass
Nice Ass,E10,E10_Slow_localization,,"Golly, who are these Asses?",SAY.Dialog_E10_Slow.55.Nice Ass
Nice Ass,E10,E10_Slow_localization,Said if Sad Ass is not in the party.,How will we ever find our Comrades?,SAY.Dialog_E10_Slow.159.Nice Ass
Nice Ass,E10,E10_Nice_localization,"Zooming over to elsewhere in the city, we see Nice Ass about to fight.",Gosh! I gotta find the others before it's too late!,SAY.Dialog:E10_Nice.11.Nice Ass
Nice Ass,E10,E10_Nice_localization,"Post Nice-Ass Fight, if lost the fight and Sad isn't in the city (left the rest of the Herd at the Zoo). The camera fades out.",Yikes...,SAY.Dialog:E10_Nice.45.Nice Ass
Nice Ass,E10,E10_Nice_localization,"Post Nice-Ass Fight, if lost the fight and Sad is in the city (was in the factory). 
Sad Ass finds Nice Ass on the ground, beaten.",Sad Ass? Is that you?,SAY.Dialog:E10_Nice.32.Nice Ass
Nice Ass,E10,E10_Nice_localization,,We... came to rescue you.,SAY.Dialog:E10_Nice.54.Nice Ass
Nice Ass,E10,E10_Nice_localization,"Post Nice-Ass Fight, if won the fight and Sad is in the city (was in the factory). 
Nice Ass finds Sad Ass on the ground, beaten.",Sad Ass! Can you hear me?,SAY.Dialog:FindingSadAss.2.Nice Ass
Nice Ass,E10,E10_Nice_localization,,That's what Comrades do.,SAY.Dialog:FindingSadAss.18.Nice Ass
Nice Ass,E10,E10_Nice_localization,,Yuppers! Of course you can!,SAY.Dialog:FindingSadAss.17.Nice Ass
Nice Ass,E10,E10_Nice_localization,They run off.,"Now, let's go find the others!",SAY.Dialog:FindingSadAss.20.Nice Ass
Nice Ass,E10,E10_Hard_localization,"The camera moves over to show the rest of the main herd arriving, starting with Nice, Slow, and potentially Sad).",Hard Ass! Smart Ass! We found you!,SAY.Dialog:E10_Hard.629.Nice Ass
Nice Ass,E10,E10_Hard_localization,,Where is—?,SAY.Dialog:E10_Hard.635.Nice Ass
Nice Ass,E10,E10_Hard_localization,These lines only occur if Sad Ass deserted the Herd at the Zoo,Still no sign of Sad Ass?,SAY.Dialog:E10_Hard.153.Nice Ass
Nice Ass,E10,E10_Hard_localization,,We could run!,SAY.Dialog:E10_Hard.165.Nice Ass
Nice Ass,E10,E10_Hard_localization,Branch 5.1: Nice offers to go inside the government building.,Yikes! Then maybe we join these other Asses and go inside!,SAY.Dialog:E10_Hard.579.Nice Ass
Nice Ass,E10,E10_Hard_localization,"If Sad is not there, Nice says this line.",We are.,SAY.Dialog:E10_Hard.187.Nice Ass
Nice Ass,E10,E10_Government_localization,,Gosh. Little Foal? Is that you?,SAY.Dialog:Occupation.472.Nice Ass
Nice Ass,E10,E10_Government_localization,,"Golly, Bad Ass, is that you?",SAY.Dialog:Occupation.525.Nice Ass
Nice Ass,E10,E10_Government_localization,,"Ask the Humans to let us have our own fields, where we can plow on our own terms!",SAY.Dialog:Nice_0.10.Nice Ass
Nice Ass,E10,E10_Government_localization,Repeater line.,Don't forget to say please!,SAY.Dialog:Nice_0.31.Nice Ass
Nice Ass,E10,E10_Government_localization,The rest of the main Herd enters into frame.,"Golly, we're a Herd!",SAY.Dialog:GoldenReadyToGo_STARTOFF.668.Nice Ass
Nice Ass,E10,E10_Government_localization,Everyone exits to face the Humans outside.,We're all coming with you!,SAY.Dialog:GoldenReadyToGo_STARTOFF.670.Nice Ass
Official Sign,E1,E1_Farm_localization,Interactable Object. Sign.,NEW Government Sponsored Highway: Connecting Urban and Rural Communities,SAY.Sign_Highway_Official.1.Official Sign
Official Sign,E1,E1_TheProtest_localization,,NEW Derriere Highway: Connecting Urban and Rural Communities,SAY.Sign_Highway_Official.1.Official Sign
Official Sign,E2,E2_World_A1_localization,"Interactable Object, Sign.",NEW Derriere Sponsored Highway: Connecting Urban and Rural Communities,SAY.Sign_Highway_Official.1.Official Sign
Official Sign,E2,E2_World_B1_localization,"Interactable Object, Sign.",NEW Government Sponsored Highway: Connecting Urban and Rural Communities,SAY.Sign_Highway_Official.1.Official Sign
Official Sign,E2,E2_World_B2_localization,"Interactable Object, Sign.",NEW Government Sponsored Highway: Connecting Urban and Rural Communities,SAY.Sign_Highway_Official.1.Official Sign
Official Sign,E2,E2_World_A3_localization,"Interactable Object, Sign.",NEW Government Sponsored Highway—Connecting Urban and Rural Communities,SAY.Sign_Highway.1.Official Sign
Old Ass,E1,E1_Stable1F_localization,The scene fades up from black to see Old Ass giving a lecture to Trusty Ass.,"...  ...  Trusty Ass? Comrade, are you listening?",SAY.Dialog: 1_OldAss_StartGame.4.Old Ass
Old Ass,E1,E1_Stable1F_localization,,Now where was I...  Right...  I was lamenting the struggles of our existence.,SAY.Dialog: 1_OldAss_StartGame.5.Old Ass
Old Ass,E1,E1_Stable1F_localization,,"Despite thousands of years of service to Humans, our Herd has lost our work.",SAY.Dialog: 1_OldAss_StartGame.7.Old Ass
Old Ass,E1,E1_Stable1F_localization,,"We have been reduced to spectators, while wretched Machines do OUR jobs in OUR beloved fields.",SAY.Dialog: 1_OldAss_StartGame.8.Old Ass
Old Ass,E1,E1_Stable1F_localization,,No longer will we suffer these INJUSTICES!,SAY.Dialog: 1_OldAss_StartGame.10.Old Ass
Old Ass,E1,E1_Stable1F_localization,,It is high time the Humans remember how useful we've always been.,SAY.Dialog: 1_OldAss_StartGame.16.Old Ass
Old Ass,E1,E1_Stable1F_localization,,To return to us the recognition and respect we deserve!,SAY.Dialog: 1_OldAss_StartGame.11.Old Ass
Old Ass,E1,E1_Stable1F_localization,,Tomorrow we will make history with our very first PROTEST.,SAY.Dialog: 1_OldAss_StartGame.22.Old Ass
Old Ass,E1,E1_Stable1F_localization,,"Now young Comrade, good group morale is instrumental to a Protest.",SAY.Dialog: 1_OldAss_StartGame.13.Old Ass
Old Ass,E1,E1_Stable1F_localization,,Use your skills and go check in with the Herd.,SAY.Dialog: 1_OldAss_StartGame.17.Old Ass
Old Ass,E1,E1_Stable1F_localization,"End of dialogue. 
Trusty is assigned the task of raising the Herd's morale.
Sturdy can run around and explore again.",Come find me when you're done.,SAY.Dialog: 1_OldAss_StartGame.18.Old Ass
Old Ass,E1,E1_Stable1F_localization,Repeater line.,Come back after you've talked to everyone!,SAY.Dialog: 2_OldAss_MoraleRepeater.4.Old Ass
Old Ass,E1,E1_Stable1F_localization,"Dialogue with Old Ass.
After having talked to all the Asses in the Herd (completing the Morale task).","Exemplary work, Comrade Trusty. Keeping up a group's morale is no easy task.",SAY.Dialog: 3_OldAss_ActivateRest.4.Old Ass
Old Ass,E1,E1_Stable1F_localization,,"Tomorrow, our waiting will come to an end and we will restore our Herd to its rightful purpose.",SAY.Dialog: 3_OldAss_ActivateRest.22.Old Ass
Old Ass,E1,E1_Stable1F_localization,,"Now hit the hay, Comrade.",SAY.Dialog: 3_OldAss_ActivateRest.7.Old Ass
Old Ass,E1,E1_Stable1F_localization,"End of dialogue. 
Sturdy can run around and explore again.",A well earned rest awaits you in the other room.,SAY.Dialog: 3_OldAss_ActivateRest.23.Old Ass
Old Ass,E1,E1_Stable1F_localization,Repeater line.,I said hit the hay in the other room! One cannot protest short on sleep.,SAY.Dialog: 3_OldAss_ActivateRest.21.Old Ass
Old Ass,E1,E1_Stable2F_localization,Trusty wakes up to find Old Ass dying,Comrade!,SAY.Dialog:Dawn.4.Old Ass
Old Ass,E1,E1_Stable2F_localization,,The Humans... they came to get me in the night.,SAY.Dialog:Dawn.18.Old Ass
Old Ass,E1,E1_Stable2F_localization,,Put me in their wretched Truck-Machine...,SAY.Dialog:Dawn.17.Old Ass
Old Ass,E1,E1_Stable2F_localization,,They gave me the Needle!,SAY.Dialog:Dawn.16.Old Ass
Old Ass,E1,E1_Stable2F_localization,,But they underestimated this old Ass.,SAY.Dialog:Dawn.15.Old Ass
Old Ass,E1,E1_Stable2F_localization,,And I... I...,SAY.Dialog:Dawn.14.Old Ass
Old Ass,E1,E1_Stable2F_localization,,I don't feel so good. Everything's getting cold...,SAY.Dialog:Dawn.13.Old Ass
Old Ass,E1,E1_Stable2F_localization,,...,SAY.Dialog:Dawn.11.Old Ass
Old Ass,E1,E1_Stable2F_localization,,"... I wish I could lead the Protest today, Trusty.",SAY.Dialog:Dawn.10.Old Ass
Old Ass,E1,E1_Stable2F_localization,,I wish I could see the faces of the Humans when they wake up to us chanting ASS POWER!,SAY.Dialog:Dawn.9.Old Ass
Old Ass,E1,E1_Stable2F_localization,,Never again will they forget how useful we Asses are!,SAY.Dialog:Dawn.8.Old Ass
Old Ass,E1,E1_Stable2F_localization,,"Please young Comrade, you have to play my role now!",SAY.Dialog:Dawn.7.Old Ass
Old Ass,E1,E1_Stable2F_localization,,Gather the Herd! Lead the Protest! Maintain the Morale!,SAY.Dialog:Dawn.30.Old Ass
Old Ass,E1,E1_Stable2F_localization,,SHOW THE WORLD THE POWER OF THE ASS!,SAY.Dialog:Dawn.25.Old Ass
Old Ass,E1,E1_Stable2F_localization,,...,SAY.Dialog:Dawn.24.Old Ass
Old Ass,E1,E1_Stable2F_localization,,Comrade...,SAY.Dialog:Dawn.23.Old Ass
Old Ass,E1,E1_Stable2F_localization,,Trusty? Are you there?,SAY.Dialog:Dawn.22.Old Ass
Old Ass,E1,E1_Stable2F_localization,Old Ass dies,... I'm scared.,SAY.Dialog:Dawn.21.Old Ass
Old Ass,E4,E4_AstralPlaneMain_localization,Sick Ass finds Old Ass regaling some Newbies with his stories.,"...And my last words, after being given the Needle, were ""Show the World the Power of the Ass!""",SAY.Dialog:OldAss.10.Old Ass
Old Ass,E4,E4_AstralPlaneMain_localization,,What can I say?,SAY.Dialog:OldAss.112.Old Ass
Old Ass,E4,E4_AstralPlaneMain_localization,,Hold on—Sick Ass? I would recognize that heavy breathing anywhere!,SAY.Dialog:OldAss.108.Old Ass
Old Ass,E4,E4_AstralPlaneMain_localization,,I was just about to introduce these Newbies to our beloved Astral Plane.,SAY.Dialog:OldAss.109.Old Ass
Old Ass,E4,E4_AstralPlaneMain_localization,,An open world where we Asses no longer have to suffer injustices or lament the struggles of our own existence!,SAY.Dialog:OldAss.66.Old Ass
Old Ass,E4,E4_AstralPlaneMain_localization,,"Not so fast, Newbie. In this marvellous place, we don't address our fellow Asses as 'Comrades'.",SAY.Dialog:OldAss.62.Old Ass
Old Ass,E4,E4_AstralPlaneMain_localization,,And Protests? We don't concern ourselves with 'Politics'!,SAY.Dialog:OldAss.47.Old Ass
Old Ass,E4,E4_AstralPlaneMain_localization,,Those are mere distractions from days gone by.,SAY.Dialog:OldAss.67.Old Ass
Old Ass,E4,E4_AstralPlaneMain_localization,,Allow me to provide all of you with the lay of the land:,SAY.Dialog:OldAss.68.Old Ass
Old Ass,E4,E4_AstralPlaneMain_localization,The camera zooms around to show the Astral Plane.,To the East—the sensual orgiastic Flats of Hawweeeheaww.,SAY.Dialog:OldAss.46.Old Ass
Old Ass,E4,E4_AstralPlaneMain_localization,,To the West—the misty Hills of Hahiah.,SAY.Dialog:OldAss.50.Old Ass
Old Ass,E4,E4_AstralPlaneMain_localization,,Surrounding these lands are the Steppes of Hawawaw—the stomping grounds for the many Asses who love to race.,SAY.Dialog:OldAss.49.Old Ass
Old Ass,E4,E4_AstralPlaneMain_localization,,This is the Shithole. But we don't talk about that.,SAY.Dialog:OldAss.99.Old Ass
Old Ass,E4,E4_AstralPlaneMain_localization,,"And this is the Pond of Hehehehe, where tonight we will make history with our very first TRAP MUSIC CONCERT. Be sure to attend!",SAY.Dialog:OldAss.53.Old Ass
Old Ass,E4,E4_AstralPlaneMain_localization,,There's a welcome rally happening at the moment.,SAY.Dialog:OldAss.97.Old Ass
Old Ass,E4,E4_AstralPlaneMain_localization,"Camera runs to dialog between Old, Sick, Gulible, and another donkey",I wish Trusty had been more patient when she arrived.,SAY.Dialog:OldAss.118.Old Ass
Old Ass,E4,E4_AstralPlaneMain_localization,,She could not adapt to the new life we have here...,SAY.Dialog:OldAss.70.Old Ass
Old Ass,E4,E4_AstralPlaneMain_localization,,"But don't be scared, I know you will all fit right in.",SAY.Dialog:OldAss.69.Old Ass
Old Ass,E4,E4_AstralPlaneMain_localization,The other two donkeys run off,Go explore and make some new friends before DJ Dope Ass's Concert tonight!,SAY.Dialog:OldAss.74.Old Ass
Old Ass,E4,E4_AstralPlaneMain_localization,,"Actually, DJ Dope Ass was looking quite nervous when I last saw him down by the Pond.",SAY.Dialog:OldAss.73.Old Ass
Old Ass,E4,E4_AstralPlaneMain_localization,,"Sick Ass, maybe you can help raise his Morale?",SAY.Dialog:OldAss.138.Old Ass
Old Ass,E4,E4_AstralPlaneMain_localization,Repeater,DJ Dope Ass is probably preparing his instruments down by the Pond. You can't miss him!,SAY.Dialog:OldAss.55.Old Ass
Old Sign,E1,E1_Farm_localization,Interactable Object. Sign.,The Heritage Stable,SAY.Sign_TheStable_Old.1.Old Sign
Old Sign,E1,E1_TheProtest_localization,,The Heritage Stable,SAY.Sign_TheStable_Old.1.Old Sign
Old Sign,E2,E2_World_A1_localization,"Interactable Object, Sign.",The Heritage Stable,SAY.Sign_TheStable_Old.1.Old Sign
Old Sign,E2,E2_World_B1_localization,"Interactable Object, Sign.",The Heritage Stable,SAY.Sign_TheStable_Old.1.Old Sign
Old Sign,E2,E2_World_B2_localization,"Interactable Object, Sign.",The Heritage Stable,SAY.Sign_TheStable_Old.1.Old Sign
