index,episode,sheet,speaker,english,dutch
1,E4,E4_AstralPlaneMain_localization,Bitter Ass,Hey Newbie. You look like you might be interested in joining our group.,Hoi Nieuweling. Jij lijkt alsof je interesse hebt om bij ons groepje te komen.
2,E4,E4_AstralPlaneMain_localization,Bitter Ass,"We're HAW. It stands for ""Humans Are the Worst.""","Wij zijn MZK. Dat staat voor ""Mensen Zijn Kak""."
3,E4,E4_AstralPlaneMain_localization,Bitter Ass,We like to gather and share stories about how much we hate Humans.,We komen graag samen om verhalen en ervaringen te delen over hoe hard we Mensen wel niet haten.
4,E4,E4_AstralPlaneMain_localization,Bitter Ass,I hate Humans because they beat me with a steel pipe!,Ik haat Mensen omdat ze met een stalen pijp bijeen sloegen!
5,E4,E4_AstralPlaneMain_localization,Bitter Ass,Feel free to meet the membership!,Kom kennis maken met onze leden!
