index,episode,sheet,speaker,english,dutch
1,E4,E4_AstralPlaneMain_localization,Lofty Ass,"Every Ass here has had their share of Protests,","Elke Ezel heeft hier zijn deel aan Protesten gehad,"
2,E4,E4_AstralPlaneMain_localization,Lofty Ass,"Strikes, Marches, Boycotts...","Stakingen, Marsen, Boycotts..."
3,E4,E4_AstralPlaneMain_localization,Lofty Ass,We were simple village donkeys when the Humans recruited my herd to do supply drops in their wars.,Wij waren simpele dorpsezels wanneer de Mensen onze Kudde gebruikte om voorraden in hun oorlogen te zeulen.
4,E4,E4_AstralPlaneMain_localization,Lofty Ass,But we held our ground and refused to be co-opted into the military industrial complex.,Maar we hielden aan ons voetstuk vast en weigerden om met de Oorlogsmachine mee te draaien.
5,E4,E4_AstralPlaneMain_localization,Lofty Ass,They didn't take kindly to our pacifism...,Onze liefde voor vrede werd ons niet in dank afgenomen.
