index,episode,sheet,speaker,english,dutch
229,E9,E9_GoldenAss_localization,{$NewName},Yes...?,Ja...?
230,E9,E9_GoldenAss_localization,{$NewName},"But Uncle Bad—Cole, we're supposed to go to the big city together!","Maar Nonkel Stoere—Piet, we zouden toch samen naar de grote stad gaan!"
231,E9,E9_GoldenAss_localization,{$NewName},"Comrade Mother, I'm not giving up on you.","Kameraad Moeder, ik geef u niet op."
232,E9,E9_GoldenAss_localization,{$NewName},"So, don't give up on me either.",Dus geef mij ook niet op.
233,E9,E9_GoldenAss_localization,{$NewName},See you soon Uncle Bad—Cole!,Tot snel Nonkel Stoere—Piet!
234,E9,E9_GoldenAss_localization,{$NewName},See you soon... Mother. I love you.,Tot snel... Moeder. Ik hou van u.
235,E10,E10_Government_localization,{$NewName},Hiya Aunties and Uncles!,Hallo Tantes en Nonkels!
236,E10,E10_Government_localization,{$NewName},"WOAH, look at all these new Ass friends!","WOAH, kijk eens naar al die nieuwe Ezelvriendjes!"
237,E10,E10_Government_localization,{$NewName},Yeah! Check it out! I'm a Prophet now! And a Machine!,Ja! Kijk kijk! Ik ben nu een Profeet! En een Machine!
238,E10,E10_Government_localization,{$NewName},"Uncle Bad—Cole, built a cool Transformation-Machine and now I can walk on two legs!",Nonkel Stoere—Piet heeft een coole Transformatie-Machine gebouwd en nu kan ik op twee benen lopen!
239,E10,E10_Government_localization,{$NewName},I can also do this!,Ik kan ook dit doen!
240,E10,E10_Government_localization,{$NewName},I think there's a setting—hold on... okay:,Ik denk dat er een instelling is—wacht even... oké:
241,E10,E10_Government_localization,{$NewName},"""Anyone want to play ROCKS?""","""Heeft iemand zin om STENEN-SPEL te spelen?"""
242,E10,E10_Government_localization,{$NewName},Wowee... okay...,Wowee... oké...
243,E10,E10_Government_localization,{$NewName},Umm... Not yet.,Euhm... Nog niet.
244,E10,E10_Government_localization,{$NewName},READY!,KLAAR!
245,E10,E10_ProphetSpeech_localization,{$NewName},WOAH! I've never seen so many Humans!,WOAH! Ik heb nog nooit zoveel Mensen gezien!
246,E10,E10_ProphetSpeech_localization,{$NewName},Okay...,Oké...
247,E10,E10_ProphetSpeech_localization,{$NewName},A Manifesto.,Een Manifest.
248,E10,E10_ProphetSpeech_localization,{$NewName},By my Aunties and Uncles and friends.,Van mijn Tantes en Nonkels en vrienden.
249,E10,E10_ProphetSpeech_localization,{$NewName},Their top demands are:,Hun belangrijkste eisen zijn:
250,E10,E10_ProphetSpeech_localization,{$NewName},{$ManifestoVar0},{$ManifestoVar0}
251,E10,E10_ProphetSpeech_localization,{$NewName},{$ManifestoVar1},{$ManifestoVar1}
252,E10,E10_ProphetSpeech_localization,{$NewName},{$ManifestoVar2},{$ManifestoVar2}
253,E10,E10_ProphetSpeech_localization,{$NewName},{$ManifestoVar3},{$ManifestoVar3}
254,E10,E10_ProphetSpeech_localization,{$NewName},{$ManifestoVar4},{$ManifestoVar4}
255,E10,E10_ProphetSpeech_localization,{$NewName},Thank you for listening.,Bedankt om te luisteren.
256,E10,E10_ProphetSpeech_localization,{$NewName},"Now that you all know the demands, we can change the System together.","Nu dat je allemaal de eisen kent, kunnen we samen het Systeem veranderen."
257,E10,E10_ProphetSpeech_localization,{$NewName},My Uncle Bad—Cole taught me that the System is rigged against Asses.,Mijn Nonkel Stoere—Piet heeft me geleerd dat het Systeem tegen Ezels is opgezet.
258,E10,E10_ProphetSpeech_localization,{$NewName},But I kinda think the System is rigged against everyone!,Maar ik denk eigenlijk dat het Systeem tegen iedereen vals speelt!
259,E10,E10_ProphetSpeech_localization,{$NewName},Because no one here looks happy.,Want niemand ziet er hier gelukkig uit.
260,E10,E10_ProphetSpeech_localization,{$NewName},Everyone looks tired.,Iedereen ziet er moe uit.
261,E10,E10_ProphetSpeech_localization,{$NewName},And a little angry.,En een beetje boos.
262,E10,E10_ProphetSpeech_localization,{$NewName},How am I doing Aunty Sick—Golden—Gods?,Tante Snot—Gouden—Goden? Lukt het mij wat?
263,E10,E10_ProphetSpeech_localization,{$NewName},"Cool, I now invite all my Aunties and Uncles and friends to sing TOGETHER!","Cool, ik nodig nu al mijn Tantes en Nonkels en vrienden uit om SAMEN te zingen!"
264,E10,E10_Epilogue_localization,{$NewName},Mother—I see a Human coming! Let's go!,Moeder—ik zie een Mens aankomen! Laten we gaan!
265,E10,E10_Epilogue_localization,{$NewName},UGH! This rain is so not good for my metal.,BAH! Deze regen is echt niet goed voor mijn metaal.
266,E10,E10_Epilogue_localization,{$NewName},The next Farm is a whole day's walk away!,De volgende Boerderij is een hele dag stappen!
267,E10,E10_Epilogue_localization,{$NewName},Do you think they'll join us?,Denkt ge dat ze zich bij ons zullen aansluiten?
