index,episode,sheet,speaker,english,dutch
1,E4,E4_AstralPlaneMain_localization,Total Ass,"Hey, Newbie! You're from Trusty's old Herd aren't you.","Hé Nieuwkomer! Jij komt van Trouwe haar oude Kudde, niet."
2,E4,E4_AstralPlaneMain_localization,Total Ass,She told us all about your Protest.,Ze vertelde ons over jullie Protest.
3,E4,E4_AstralPlaneMain_localization,Total Ass,"Those were the days, my friends. Those. Were. The. Days.","Dat waren de dagen, vrienden. Dat. Waren. De. Dagen."
4,E4,E4_AstralPlaneMain_localization,Total Ass,My herd did a Boycott against long travels on the Silk Road.,Mijn Kudde heeft een Boycott tegen de lange reizen op de Zijderoute gepleegd.
5,E4,E4_AstralPlaneMain_localization,Total Ass,We even made a Barricade once and almost shut down the spice trade.,We hebben zelfs de weg gebarricadeerd en de hele kruidenhandel lam gelegd!
6,E4,E4_AstralPlaneMain_localization,Total Ass,Those were the days.,Dat waren de dagen.
